### ISSUE TITLE
disabling and then enabling dhcp on ovn network requires instance restart

### ISSUE THREAD

**Issue by gwenya** [lxc/incus#1737]
Setting `ipv4.dhcp` to false in the settings of an OVN network disables DHCP, but setting it to `true` again does not properly enable it. Only after an instance is restarted does it get responses to DHCP queries again.

```
$ ovs-tcpdump -i veth80cd5c04
tcpdump: verbose output suppressed, use -v[v]... for full protocol decode
listening on miveth80cd5c04, link-type EN10MB (Ethernet), snapshot length 262144 bytes

# run udhcpc in the instance

13:34:06.388393 IP 0.0.0.0.bootpc > 255.255.255.255.bootps: BOOTP/DHCP, Request from 00:16:3e:59:4c:dc (oui Unknown), length 300
13:34:06.389189 IP 0.0.0.0.bootpc > 10.1.2.2.bootps: BOOTP/DHCP, Reply, length 302
13:34:06.389195 IP 10.1.2.1.bootps > 10.1.2.2.bootpc: BOOTP/DHCP, Reply, length 302
13:34:06.408389 IP 0.0.0.0.bootpc > 255.255.255.255.bootps: BOOTP/DHCP, Request from 00:16:3e:59:4c:dc (oui Unknown), length 300
13:34:06.408950 IP 0.0.0.0.bootpc > 10.1.2.2.bootps: BOOTP/DHCP, Reply, length 302
13:34:06.408956 IP 10.1.2.1.bootps > 10.1.2.2.bootpc: BOOTP/DHCP, Reply, length 302

# set ipv4.dhcp to false

# run udhcpc in the instance again

13:34:26.517917 IP 0.0.0.0.bootpc > 255.255.255.255.bootps: BOOTP/DHCP, Request from 00:16:3e:59:4c:dc (oui Unknown), length 300
13:34:31.996399 IP 0.0.0.0.bootpc > 255.255.255.255.bootps: BOOTP/DHCP, Request from 00:16:3e:59:4c:dc (oui Unknown), length 300
13:34:35.021480 IP 0.0.0.0.bootpc > 255.255.255.255.bootps: BOOTP/DHCP, Request from 00:16:3e:59:4c:dc (oui Unknown), length 300

# set ipv4.dhcp to true

# run udhcpc in the instance again

13:34:56.044955 IP 0.0.0.0.bootpc > 255.255.255.255.bootps: BOOTP/DHCP, Request from 00:16:3e:59:4c:dc (oui Unknown), length 300
13:34:59.071700 IP 0.0.0.0.bootpc > 255.255.255.255.bootps: BOOTP/DHCP, Request from 00:16:3e:59:4c:dc (oui Unknown), length 300

```

After rebooting the instance it has a fresh interface and gets dhcp responses again.

I think the issue is that setting dhcp to true creates a row in the OVN DHCP_Options table but doesn't apply those options to any ports, instead they only get applied when the port is created.

**Comment by stgraber** [comment]
Yeah. We may be able to loop through the affected instances and mangle things back into shape.

**Comment by stgraber** [comment]
@gwenya is that something you'd like to look into?

**Comment by gwenya** [comment]
yeah absolutely

**Comment by gwenya** [comment]
Looking at the code for getting the existing dhcp options from ovn, there are two places that this is done which I would like to extract into a method, but they are slightly different and I'm wondering if that is intentional or not.

When configuring a network: https://github.com/lxc/incus/blob/22ad8d0e29101791a9726d359ddf24ee56139d6d/internal/server/network/driver_ovn.go#L2607-L2618

When configuring a port: https://github.com/lxc/incus/blob/22ad8d0e29101791a9726d359ddf24ee56139d6d/internal/server/network/driver_ovn.go#L3894-L3905

In the first case it just checks if the CIDR of the option is any IPv4 address, while in the second case it specifically checks if it is the IPv4 address of the network. I think these should be equivalent since only the options belonging to the switch of the network are queried to begin with, but I'm not completely certain. Maybe it makes a difference if the CIDR of the network is modified? But in that case the options should be modified as well, right?

Also when configuring a network if there are multiple dhcp options of the same family that is just ignored, while when configuring a port that is an error. I figure it should probably an error in both cases.

**Comment by stgraber** [comment]
> In the first case it just checks if the CIDR of the option is any IPv4 address, while in the second case it specifically checks if it is the IPv4 address of the network. I think these should be equivalent since only the options belonging to the switch of the network are queried to begin with, but I'm not completely certain. Maybe it makes a difference if the CIDR of the network is modified? But in that case the options should be modified as well, right?

Yeah, I can't think of a good reason for the subnet check. It would work to detect a broken network where the subnet was changed but the DHCP config didn't, but ignoring such records still seems wrong as it would just lead to pointless dhcp options being left in the OVN database. So yeah, the much simpler family-only check is likely the way to go here.

> Also when configuring a network if there are multiple dhcp options of the same family that is just ignored, while when configuring a port that is an error. I figure it should probably an error in both cases.

Yeah, that should lead to an error as that would indicate that something's quite bad/inconsistent in the OVN database.

**Comment by gwenya** [comment]
perfect, thank you!
